{"tool":"tiny_nexus","version":"1.0.0","seed":20260711,"dials":{"m_p":1.000000000e+00,"c":2.000000000e+01,"hbar":5.000000000e-01,"G":2.000000000e-03,"dt":4.166666667e-03,"L_box":5.120000000e+02,"k_B":1.000000000e+00},"derived":{"lambda_dB_v1":5.000000000e-01,"r_s_1e5":1.000000000e+00,"r_s_1e2":1.000000000e-03,"v_circ_1e4_r10_over_c":7.071067812e-02,"T_H_1e5":7.957747155e-01,"T_H_1e3":7.957747155e+01,"span_decades":3.522878745e+00},"results":[{"id":"N1","name":"dials","pass":true,"metrics":{"lambda_dB_v1":5.000000000e-01,"r_s_1e5":1.000000000e+00,"r_s_1e2":1.000000000e-03,"v_circ_1e4_r10_over_c":7.071067812e-02,"T_H_1e5":7.957747155e-01,"T_H_1e3":7.957747155e+01,"T_H_ratio":1.000000000e+02,"n_classical_nominal":3.000000000e+01,"n_star_nominal":1.000000000e+04,"n_bh_rs1su":1.000000000e+05,"span_decades":3.522878745e+00}},{"id":"N2","name":"kepler","pass":true,"metrics":{"de_max":7.394716089e-10,"dl_max":5.761777862e-13,"peri_drift_per_orbit":6.720221535e-10,"ecc0":6.000000000e-01,"orbits":1.000000000e+02}},{"id":"N3","name":"pn1","pass":true,"metrics":{"prec_meas_rad_per_orbit":1.507141158e-01,"prec_exact_rad_per_orbit":1.472621556e-01,"rel_err":2.344091821e-02,"passages":3.000000000e+01}},{"id":"N4","name":"pw","pass":true,"metrics":{"r_isco_meas":3.000000008e+00,"r_isco_exact":3.000000000e+00,"rel_err":2.747991390e-09,"captured":1.000000000e+00,"t_capture_s":2.616666667e+00}},{"id":"N5","name":"qm","pass":true,"metrics":{"sigma_meas":2.000208594e+00,"sigma_exp":2.000208594e+00,"sigma_rel_err":5.773159728e-15,"e0_meas":2.500000000e-01,"e0_exp":2.500000000e-01,"e0_rel_err":1.254552018e-13}},{"id":"N6","name":"ratchet","pass":true,"metrics":{"p_meas_r1":7.143010000e-01,"p_exact_r1":7.142857143e-01,"rel_err_r1":2.140000000e-05,"p_meas_r4":2.603917000e-01,"p_exact_r4":2.603082049e-01,"rel_err_r4":3.207547200e-04,"p_meas_r16":4.571000000e-03,"p_exact_r16":4.591466597e-03,"rel_err_r16":4.457529287e-03,"trials_per_r":1.000000000e+07}},{"id":"N7","name":"rapidity","pass":true,"metrics":{"v_lt_c_min_gap":3.552713679e-15,"agree_max_rel_gamma_le_100":5.473399511e-14,"cosh_rel_err_1e7":1.554312234e-15,"naive_max_err_ladder":1.000000000e+00,"naive_err_1e7":3.998786453e-04,"err_ratio_naive_over_cosh":6.433713753e+14,"gamma_beta_8nines":7.071067814e+03,"omega_1e7":1.681124283e+01}},{"id":"N8","name":"tau","pass":true,"metrics":{"sr_err":0.000000000e+00,"static_err":0.000000000e+00,"circ_err":1.110223025e-16}},{"id":"N9","name":"t_emit","pass":true,"metrics":{"solver_vs_closed":0.000000000e+00,"rate_static":8.000000000e-01,"rate_exact":8.000000000e-01,"mean_rate_orbiting":7.976190052e-01,"mean_rate_rel_err":2.976243540e-03,"lag_monotone":1.000000000e+00}},{"id":"N10","name":"compose","pass":true,"metrics":{"e_binary_drift":1.935951399e-14,"e_orbiter_drift":2.445865732e-13,"e_photon_drift":0.000000000e+00,"h_packet_drift":1.674216321e-13,"packet_sigma_rel_err":1.810815164e-09,"masks_stable":1.000000000e+00,"mask_binary":1.800000000e+01,"mask_photon":3.600000000e+01,"mask_orbiter":2.800000000e+01,"photon_frames_ok":1.000000000e+00,"nan_free":1.000000000e+00,"ticks":1.000000000e+04}},{"id":"N11","name":"det","pass":true,"metrics":{"identical":1.000000000e+00,"inprocess_repeats":2.000000000e+00}}],"verdict":"pass","notes":"non-declared; hash=ad64f810"}
